{
  "schema_version": "1.0",
  "scenario_id": "server-disconnect-demo",
  "description": "Temporarily isolate the server from its local Docker network and reconnect it.",
  "targets": [
    {
      "name": "api-server",
      "service": "server"
    }
  ],
  "actions": [
    {
      "id": "isolate-server-network",
      "type": "disconnect",
      "target": "api-server",
      "start_after_seconds": 1,
      "duration_seconds": 5,
      "parameters": {
        "direction": "both"
      }
    }
  ],
  "expected_outcomes": [
    "The server is unreachable from other Compose services while isolated.",
    "The server service-name alias works again after reconnection."
  ],
  "safety": {
    "scope": "local_docker_only",
    "cleanup_required": true,
    "max_total_duration_seconds": 15
  }
}
